{
    "$schema": "https://raw.githubusercontent.com/Unkn0wnCat/keyindex/main/data/schemas/keyservers.schema.json",
    "name": "Ubuntu",
    "homepage": "https://keyserver.ubuntu.com/",
    "source": "https://keyserver.ubuntu.com/",
    "urls": [
        {
            "url": "https://keyserver.ubuntu.com",
            "protocol": "hkps"
        }
    ]
}